TE,GZ102,Tiếng Trung 2,GZ101 (0),,2
TE,GZ103,Tiếng Trung 3,GZ102 (0),,2
TE,IFB10,Lý thuyết tài chính tiền tệ,,48,2
TE,IM001,Kỹ năng CNTT cơ bản,,,0
TE,IM002,Kỹ năng soạn thảo VB(MS Office),,36,3
TE,IM003,Kỹ năng soạn thảo VB(open Office),,36,3
TE,IM004,Ứng dụng Excel,,,3
TE,IM201,Kỹ năng soạn thảo VB (MS office),IM001 (0),,3
TE,IM202,Kỹ năng soạn thảo văn bản (Open Office),IM001 (0),,3
TE,IM203,Ứng dụng Excel,"IM201 (0), IS206 (1)",,3
TE,IM204,Ứng dụng Cal,IM202 (0),,3
TE,IP403,Thực tập ngành Hệ thống thông tin,,107,2
TE,IS009,Máy tính và Internet,,,1
TE,IS101,Tin văn phòng,,,3
TE,IS201,Tin quản lý Access,"IS206 (0), IS101 (1)",,3
TE,IS206,Kĩ năng soạn thảo văn bản,IS009 (0),72,3
TE,IS207,Ứng dụng Exel,IS206 (0),,3
TE,IS222,Cơ sở dữ liệu,"CS121 (0), CS121 (1), MA102 (0), MA101 (1), MA101A (2), MA100A (2), CS121 (2), CS121 (3), MA103 (3)",,3
TE,IS222A,Bài tập lớn về CSDL,,,2
TE,IS223A,Cơ sở dữ liệu 2,,,2
TE,IS224A,Cơ sở dữ liệu phân tán,,,2
TE,IS301,Tin học văn phòng nâng cao,CS100 (0),100,3
TE,IS314,Hệ thống thông tin,IS222 (0),,3
TE,IS315,Mô hình hóa quy trình nghiệp vụ,IS314 (0),,2
TE,IS316,Hạ tầng công nghệ thông tin,IS314 (0),,2
TE,IS317,Hạ tầng công nghệ thông tin,,,2
TE,IS320,Thực hành quản lý dự án hệ thống thông tin,SE320 (0),,3
TE,IS322,Hệ quản trị cơ sở dữ liệu,"IS222 (0), IS222A (1), IS224A (2), IS223A (3)",,3
TE,IS322E,Hệ quản trị cơ sở dữ liệu,,,4
TE,IS325,Cơ sở dữ liệu phân tán,"IS222 (0), NW212 (0)",,2
TE,IS326,Khai phá dữ liệu,IS322 (0),,3
TE,IS327,Kho dữ liệu,IS322 (0),,3
TE,IS328,Cơ sở dữ liệu nâng cao,IS322 (0),,3
TE,IS332,Phân tích thiết kế hướng đối tượng,"CS122 (0), IS222 (0), CS122A (1), CS122B (2), IS222A (3), IS223A (4), IS224A (5)",,3
TE,IS333,Phân tích thiết kế hệ thống thông tin,"IS222 (0), IS222A (1), IS223A (2), IS224A (3)",,2
TE,IS333A,PT&TK hệ thống thông tin quản lý 1,,,2
TE,IS333B,PT&TK hệ thống thông tin quản lý 2,,,2
TE,IS334,Quản lý dự án hệ thống thông tin,"IS332 (0), SE302 (1)",,3
TE,IS335,Phát triển ứng dụng doanh nghiệp,SE302 (0),,3
TE,IS336,Triển khai và kiểm soát hệ thống thông tin doanh nghiệp,IS335 (0),,3
TE,IS345,An toàn thông tin,,,3
TE,IS381,Hệ thống thông tin quản lý,,90,3
TE,IS382,Công nghệ thông tin trong doanh nghiệp,"BA101 (0), MK202 (2), MK201 (0), BA101 (2), MK202 (1), BA102 (1), BA102 (3), MK201 (3)",100,2
TE,IS383,Hệ thống thông tin nâng cao,"IS332 (0), IS314 (1)",,2
TE,IS384,Một số vấn đề hiện đại về hệ thống thông tin,IS383 (0),,3
TE,IS424,Lập trình cơ sở dữ liệu,"IS332 (0), IS322 (1)",,3
TE,IS480,Kiến trúc doanh nghiệp,IS383 (0),,3
TE,IS481,Quản lý hệ thống thông tin chiến lược,IS383 (0),,3
TE,IS484,CĐTN: Cơ sở dữ liệu,"IS322 (0), IS322E (1)",117,6
TE,IS487,CĐTN: Hệ thống thông tin quản lý,"IS381 (0), IS332 (1)",110,6
TE,IS487A,CĐTN: Công nghệ XML,,,6
TE,IS488,CĐTN: Hệ thống thông tin doanh nghiệp,IS381 (0),110,6
TE,IS489,CĐTN: Hệ thống thông tin ngân hàng,"IS381 (0), IS382 (1)",110,6
TE,IS499,KLTN ngành Hệ thống thông tin,,127,6
TE,MA100A,Toán 1,,,2
TE,MA101,"Logic, suy luận toán học và kỹ thuật đếm (Tiếng Anh)",GE103 (0),,3
TE,MA101A,"Logic, suy luận toán học và kỹ thuật đếm",,,3
TE,MA102,Toán cơ sở,,,3
TE,MA103,Số và cấu trúc đại số,,,3
TE,MA104,Số và cấu trúc đại số,,,3
TE,MA110,Giải tích 1,,,3
TE,MA110A,Giải tích 1A,,,2
TE,MA111,Giải tích 2,MA110 (0),,3
TE,MA111A,Giải tích 2A,,,2
TE,MA111B,Giải tích 2B,,,2
TE,MA120,Đại số tuyến tính,,,3
TE,MA120A,Đại số tuyến tính 1,,,2
TE,MA120B,Đại số tuyến tính 2,,,2
TE,MA142,"Đại số tuyến tính, giải tích và ứng dụng trong kinh tế","MA102 (1), MA100A (2), EC101 (0), EC101 (1), EC101 (2), MA101A (3), EC101 (3)",,4
TE,MA142A,Đại số tuyến tính,,,2
TE,MA142B,Giải tích trong kinh tế,"MA101 (0), MA102 (1)",,2
TE,MA212,Phương trình vi phân,"MA111 (0), MA111A (1), MA111B (2)",,2
TE,MA222,Đại số đại cương,"MA120 (0), MA120A (1), MA120B (2)",,2
TE,MA230,Xác suất,"MA111 (0), MA111A (1), MA111B (2)",,3
TE,MA231,Xác suất thống kê ứng dụng,"MA120A (6), MA110 (6), IS101 (6), CS100 (0), MA120 (0), IS101 (1), MA142 (1), MA142 (2), CS100 (3), MA120A (3), CS100A (4), MA120A (5), CS100A (5), CS100A (7), MA142 (7), CS100 (8), MA142 (8), IS009 (9), MA120 (4), MA142 (9), IM201 (6), MA142 (6)",,4
TE,MA231A,Thống kê 1,,,2
TE,MA231B,Thống kê 2,,,2
TE,MA241,Toán tài chính,"MA142 (0), MA142B (1), MA142A (1), MA110 (2), MA111 (2), MA120A (2)",,2
TE,MI201,Toán rời rạc,CS122 (0),,3
TE,MI312,Đồ họa,"CS122 (0), MA120 (0), CS122A (1), CS122B (2), MA120A (3), MA120B (4)",,2
TE,MI321,Trí tuệ nhân tạo,"CF212 (0), CF212A (1), CF212B (2), MI201 (0), MI201 (1), MI201 (2)",,3
TE,MK201,Nguyên lý marketing,"EC101 (0), EC203A (1), EC203B (1)",,2
TE,MK202,Marketing căn bản,EC101 (0),,3
TE,MK311,Quản trị Marketing,MK201 (0),,3
TE,MK312,Quản trị thương hiệu,MK201 (0),,2
TE,MK313,Quản trị thương hiệu,"MK201 (0), MK202 (1)",,3
TE,MK331,Marketing ngân hàng,"MK201 (0), BK201 (0)",,2
TE,MK333,Marketing dịch vụ,"MK201 (0), MK202 (1)",,2
TE,MK423,Quan hệ cộng đồng,,50,2
TE,MK424,Quản trị bán hàng,"MK201 (0), MK202 (1)",,3
TE,ML101,Những NLCB của chủ nghĩa Mác - Lênin,,,5
TE,ML111,Triết học Mác – Lênin,,,2
TE,ML112,Kinh tế chính trị và CNXH khoa học,,,3
TE,ML112A,Kinh tế chính trị,,,3
TE,ML112B,Chủ nghĩa xã hội khoa học,,,2
TE,ML202,Tư tưởng Hồ Chí Minh,"ML111 (0), ML101 (1), ML112A (2), ML112B (3)",,2
TE,ML203,Đường lối cách mạng của Đảng CS Việt Nam,ML202 (0),,3
TE,NA151,Khoa học môi trường,,,2
TE,NW210,Hệ thống mạng máy tính,CS100 (0),,3
TE,NW212,Mạng máy tính,"CS212 (0), CS212A (1), CS212B (2)",,2
TE,NW212A,Internet,,,2
TE,NW312,Thiết kế và quản trị mạng,"NW212 (0), NW212A (1)",,3
TE,NW312A,Thiết kế quản trị mạng,,,4
TE,NW322,Lập trình mạng,"NW312 (0), NW312A (1)",,2
TE,NW332,An toàn mạng,"NW312 (0), NW312A (1)",,3
TE,NW332A,An toàn mạng,,,4
TE,NW439,CĐTN: An toàn mạng,"NW312 (0), NW312A (1)",117,6
TE,PE201,Tiếng Anh trong tin học 1A,"GE202 (0), GE201 (0)",,2
TE,PE221,Tiếng Anh doanh nghiệp 1A,"GE202 (0), GE201 (0)",,2
TE,PE302,Tiếng Anh trong tin học 1B,"GE202 (0), PE201 (0)",,2
TE,PE303,Tiếng Anh trong tin học 2A,"PE201 (0), PE302 (0)",,2
TE,PE304,Tiếng Anh trong tin học 1,"GE201 (0), GE202 (0), GE201 (1), GE202A (1), GE201A (2), GE202A (2)",,2
TE,PE305,Tiếng Anh trong tin học 2,"PE304 (0), GE202 (0), GE202 (1), PE201 (1), GE202A (2), PE304 (2), GE202A (3), PE201 (3)",,2
TE,PE322,Tiếng Anh doanh nghiệp 1B,"PE221 (0), GE202 (0)",,2
TE,PE323,Tiếng Anh doanh nghiệp 2A,"PE322 (0), PE221 (0)",,2
TE,PE404,Tiếng Anh trong tin học 2B,"PE303 (0), PE302 (0)",,2
TE,PE424,Tiếng Anh doanh nghiệp 2B,"PE323 (0), PE322 (0)",,2
TE,PG100,Giáo dục thể chất,,,4
TE,PG100A,Giáo dục thể chất,,,4
TE,PG101,GDTC: Lý thuyết,,,1
TE,PG102,GDTC: Thể dục cổ truyền cơ bản,,,1
TE,PG103,GDTC: Thể dục cổ truyền nâng cao,PG102 (0),,1
TE,PG104,GDTC: Cầu lông cơ bản,,,1
TE,PG105,GDTC: Cầu lông nâng cao,PG104 (0),,1
TE,PG106,GDTC: Bóng bàn cơ bản,,,1
TE,PG107,GDTC: Bóng bàn nâng cao,PG106 (0),,1
TE,PG108,GDTC: Thể dục nhịp điệu cơ bản,,,1
TE,PG109,GDTC: Thể dục nhịp điệu nâng cao,PG108 (0),,1
TE,PG110,GDTC: Bơi cơ bản,,,1
TE,PG111,GDTC: Khiêu vũ thể thao cơ bản,,,1
TE,PG112,GDTC: Khiêu vũ thể thao nâng cao,PG111 (0),,1
TE,PG113,GDTC: Bóng rổ cơ bản,,,1
TE,PG114,GDTC: Bóng rổ nâng cao,PG113 (0),,1
TE,PG115,GDTC: Bóng chuyền cơ bản,,,1
TE,PG116,GDTC: Bóng chuyền nâng cao,PG115 (0),,1
TE,PG117,GDTC: Thể dục dã ngoại,,,1
TE,PG118,GDTC: Thể dục cơ bản,,,1
TE,PG119,GDTC: Thể dục Erobic,,,1
TE,PG120,Thể dục cơ bản nâng cao,PG118 (0),,1
TE,PG121,Giáo dục quốc phòng,,,4
TE,PG121D,Đường lối quân sự của Đảng,,,2
TE,PG121E,Công tác quốc phòng - an ninh,,,2
TE,PG122,GDQP: Đường lối quân sự của Đảng,,,1
TE,PG123,GDQP: Công tác quốc phòng - an ninh,,,1
TE,PG124,GDQP: Quân sự chung,,,1
TE,PG125,GDQP: Kỹ thuật bắn súng,,,1
TE,PG131,GDTC: Bóng rổ nâng cao 1,,,1
TE,PG132,GDTC: Bóng rổ nâng cao 2,,,1
TE,PG133,GDTC: Bóng rổ nâng cao 3,,,1
TE,PG134,GDTC: Bóng rổ nâng cao 4,,,1
TE,PG141,GDTC: Bóng chuyền nâng cao 1,,,1
TE,PG142,GDTC: Bóng chuyền nâng cao 2,,,1
TE,PG143,GDTC: Bóng chuyền nâng cao 3,,,1
TE,PG144,GDTC: Bóng chuyền nâng cao 4,,,1
TE,PG150,Bóng đá,,,4
TE,PG151,Bóng đá nâng cao,,,4
TE,PG160,Nhảy hiện đại,,,4
TE,PG161,Nhảy hiện đại nâng cao,,,4
TE,PV101,Tiếng Việt thực hành,,,2
TE,SC201,Kỹ năng giao tiếp và thuyết trình,,36,2
TE,SE302,Công nghệ phần mềm,IS332 (0),,2
TE,SE312,Kiểm thử và đảm bảo chất lượng phần mềm,SE302 (0),,3
TE,SE320,Quản lý dự án công nghệ thông tin,SE302 (0),,3
TE,SE422,Quản lý dự án phần mềm,SE302 (0),,3
TE,SE487,CĐTN: Phát triển phần mềm,SE302 (0),117,6
TE,SH131,Pháp luật đại cương,,,2
TE,SM201,Phương pháp luận nghiên cứu khoa học,,36,3
TE,ST450,Toeic,,,3
TE,TE499,KLTN Hệ thống thông tin quản lý,,120,6
TE,VL101,Tiếng Việt thực hành,,,2
TE,VR201,Ẩm thực Việt Nam,,,3
TE,VR203,Ẩm thực Việt Nam,,,4
TE,VR203A,Ẩm thực Việt Nam,,,3
